{
  "$schema":"https://json-schema.org/draft/2020-12/schema", "type":"object", "additionalProperties":false,
  "required":["schemaVersion","forbiddenPathFragments","forbiddenExtensions","maxFileSizeBytes"],
  "properties":{"schemaVersion":{"const":1},"forbiddenPathFragments":{"type":"array","minItems":1,"items":{"type":"string","minLength":1}},"forbiddenExtensions":{"type":"array","minItems":1,"items":{"type":"string","pattern":"^\\."}},"maxFileSizeBytes":{"type":"integer","minimum":1}}
}
